<?xml version="1.0" encoding="UTF-8" ?>
<xs:schema
xmlns:xs="http://www.w3.org/2001/XMLSchema">
<xs:element name="contact">
<xs:complexType>
<xs:sequence>
<xs:element name="name"
type="xs:string"/>
<xs:element name="surname"
type="xs:string"/>
<xs:element name="country"
type="xs:string"/>
<xs:element name="city"
type="xs:string"/>
<xs:element name="addres"
type="xs:string"/>
<xs:element name="post"
type="xs:string"/>
<xs:element name="age"
type="xs:string"/>
</xs:sequence>
</xs:complexType>
</xs:element>
</xs:schema>